SL NO.,Accident_Index,Police_Force,Accident_Severity,Number_of_Vehicles,Number_of_Casualties,ACCIDENT Date,DEATH,Day_of_Week,Time of day,LOCATION DISTANCE FROM P S ,vic_Vehicle_Reference,vic_Vehicle_Type,vic_Age,vic_sex,ACCT DETAILS,OCCUPATION,strik_Vehicle_Reference,strik_Vehicle_Type,strik_Age,strik_Sex,strik_Vehicle_Manoeuvre
1,0001/2011,BIAL P S,FATAL,2,2,40544,40544,SATURDAY,0.229166667,5KM SOUTH,KA 05 HD8975,2W,23,M,DIED ON SPOT,2W HIT THE TEMPO,KA 05 AC4874,TEMPO,27,M,
,0001/2011,BIAL P S,FATAL,,,40544,40558,,,,,2W,27,M,DIED IN HOSPITAL,,,TEMPO,,,
2,001/2011,BANASWADI TRAFFIC PS ,FATAL,1,1,40544,40544,SATURDAY,0.770833333,1 KM,,PED,47,M,DIED ON SPOT,,KA01 FA-2291,BMTC- BUS,,M,RASH DRIVING
3,0001/2011,UPPARPET TRAFFIC P S,FATAL,2,1,40545,40545,SUNDAY,0.864583333,0.5 KM,KA05 MB 5665,CAR,22,M,,,KA05 AA 1058,AUTO,35,M,RASH DRIVING
4,0002/2011,PEENYA TRAFFIC PS,FATAL,1,2(1 DEATH),40908,40546,FRIDAY,0.989583333,4 KM,KA 32R 3260,2W PILLION,24,M,HIT ON STONE,,,2W ,23,M,
5,0003/2011,K R PURAM TRAFFIC P S,FATAL,2,1,40547,,TUESDAY,0.364583333,3 KM,KA 04 EM 450,2W,_,M,"LORRY HIT, PILLION DIED",,KA06 2301,LORRY,,M,CROSSING
6,0003/2011,KUMARASWAMY LAYOUT TRAFFIC PS,FATAL,2,1,40562,,WEDNESDAY,0.604166667,4 KM,KA05 HC 9142,2W-ACTIVA,,M,CAR HIT,,KA53 M 358,CAR,,M,RASH DRIVING
7,0003/2011,CHICKPET TRAFFIC P S,FATAL,1,1,40568,,,0.375,1 KM,,PED,73,_,HIT AND RUNAWAY- FOOT PATH,,UNKNOWN,UNKNOWN,,,
8,0004/2011,HEBBAL TRAFFIC PS,FATAL,2,1,40550,,FRIDAY,0.4375,2 KM,KA 35 R 3821,2W PILLION,28,M,LORRY HIT M/C AT BACK AND LORRY RAN OVER M/C BODY,,KA 09 B 684,LORRY,,M,RASH DRIVING
9,0004/2011,ELECTRONIC CITY TRAFFIC PS,FATAL,1,1,40550,,FRIDAY,0.909722222,4 KM,,PED,35,M,CAR HIT,,KA02 AB 75,TAXI CAR,30,M,RASH DRIVING
10,0005/2011,HEBBAL TRAFFIC PS,FATAL,1,2(1 DIED),40551,,SATURDAY,0.84375,7.5 KM,KA 04 EY 536,2W PILLION,56,F,,,KA 04 EY 536,2W ,,M,SPEEDY DRIVING-UNCONTROLLABLE
11,0005/2011,CHIKKAJALA TRAFFIC PS,FATAL,1,2(1 DIED),40555,40555,WEDNESDAY,0.583333333,20 KM,KA04 HC 4617,2W PILLION,26,M,LOST CONTROL ,,KA04 HC 4617,2W ,,M,RASH DRIVING
12,0005/2011,ADUGODI TRAFFIC PS,FATAL,1,1,40557,,FRIDAY,0.402777778,1 KM,,PED,45,M,,,,CAR/JEEP,28,M,HIT PED AS VEH GEAR WAS IN REVERSE
13,0006/2011,CHIKKAJALA TRAFFIC PS,FATAL,1,1,40557,40558,FRIDAY,0.854166667,15 KM,,PED,,M,,,KA04 S 8925,2W ,,M,HIT PED WHIE CROSSING ROAD
14,0005/2011,ASHOK NAGAR TRAFFIC PS,FATAL,2,,40566,,SUNDAY,0.41875,0.5 KM,,CYCLIST,63,M,,,KA 05 MD 5822,CAR,20,M,SPEEDY DRIVING-HIT IN FRONT OF CYCLE
15,0007/2011,YESHWANTHPUR TRAAFFIC PS,FATAL,2,1,40549,,THURSDAY,0.833333333,3.5 KM,KA 04 TC 81,2W,21,M,,,KA01F4932,BUS(BMTC),,M,WHILE TAKING U TURN HIT THE 2W AND 2W RIDER WENT IN THE REAR WHEEL
16,0007/2011,R T NAGAR TRAFFIC PS,FATAL,2,1,40335,,SUNDAY,0.927083333,2 KM,KA04ER4944,2WPILLION RIDER,45,F,,,KA32M4833,CAR,,,DASHED 2W FROM BEHIND
17,0007/2011,BYATRARAYANAPURA TRAFFIC PS,FATAL,2,1,40556,,TUESDAY,0.322916667,0.5 KM,KA02HF2133,2W,,M,,,KA02AA5027,LORRY,,M,DASHED ON THE 2W KILLING VICTIM INSTANTLY
18,0006/2011,ASHOK NAGAR TRAFFIC PS,FATAL,2,2( 1 DIED),40571,,FRIDAY,0.559027778,2 KM,KA02EJ2518,2W,25,M,SUSTAINED INJURY ON HEAD,,KA05AA9606,BUS(PRIVATE),,M,DASHED TO 2W AND BOTH RIDERS FELL ON ROAD
19,0008/2011,BANASHANKARI PS,FATAL,1,1,40564,,FRIDAY,0.9375,2 KM,KA05B7768,3W,,M,HIT ON COCONUT TREE ,,,COCONUT TREE,,,
20,0009/2011,BIAL TRAFFIC PS,FATAL,2,1,40559,,SUNDAY,0.541666667,5 KM,KA50E7242,2W,56,F,"TWO 2W HIT FRONT TO FRONT COLLISION, BOTH VEHICLES RASH DRIVING",,KA04EL3049,2W ,,M,
21,0009/2011,RAJAJINAGAR TRAFFIC PS,FATAL,1,1,40564,,FRIDAY,0.965277778,6 KM,,PED,40,M,PED CROSSING ROAD HIT BY UNKNOWN VEHICLEAND UNKNOWN DRIVER,,UNKNOWN,UNKNOWN,,,
22,0009/2011,HALASUR TRAFFIC PS,FATAL,2,1,40568,,TUESDAY,0.375,1 KM,KA03EY8677,2W,53,M,CAR HIT THE STATIONARY 2W KILLING THE 2W RIDER,,KA03MC1445,CAR,.,.,
23,0010/2011,MICO LAYOUT TRAFFIC PS,FATAL,5,2,40556,,TUESDAY,0.371527778,2 KM,KA03B5878,3W,27,M,DRIVER,"LORRY HIT PVT BUS, AUTO AND 2W WAITING FOR SIGNAL, AUTO GOT JAMMED IN BET LORY AND BMTC BUS IN FRONT OF AUTO",KA519009,LORRY,1,M,
24,,,FATAL,,,,,,,,,3W,27,M,PASSENGER DIED,,KA01F2336,BUS(BMTC BUS),,M,
25,0010/2011,WHITEFIELD TRAFFIC PS,FATAL,2,3,40563,,TUESDAY,0.041666667,6.5 KM,KA02HF532,2W,25,M,,,KA076538,CAR,,,
26,,,FATAL,,,,,,,,,2W,26,M,,,,CAR,,,
27,,,FATAL,,,,,,,,KA076538,CAR,22,M,RIDDER IN JEEP,,KA02HF532,2W,29,M,"TATA SUMO CAME ANH HIT 2W CAUSING DEATH OF THREE, 2 FROM 2W AND 1 RIDER FROM CAR, CAR DRIVER ESCAPED."
28,0010/2011,BASAVANAGUDI TRAAFFIC PS,FATAL,1,1,40566,,SUNDAY,0.4375,0.5 KM,,PED,68,M,PED CROSSING ROAD HIT BY 2W AND UNKNOWN DRIVER,NIMHANS HOSPITAL,,2W,.,.,
29,0011/2011,BYATRARAYANAPURA TRAFFIC PS,FATAL,1,1,40559,,SUNDAY,0.71875,0.5 KM,,PED,,M,DASHED ON PED NEAR TEMPLE,,KA02HE3459,2W,,M,RASH DRIVING
30,0012/2011,RT NAGAR TRAFFIC PS,FATAL,,,40469,,SUNDAY,0.28125,3 KM,,PED,47,M,DEAD BODY FOUND ND UNDER INVESTIGATION FOUND CASE OF ACCIDENT,,UNKNOWN,UNKNOWN,UNKNOWN,UNKNOWN,
31,0012/2011,BIAL TRAFFIC PS,FATAL,2,4,40565,,SATURDAY,0.15625,1 KM,AP02X8549,TEMPO,21,M,"LORRY AND TEMPO HIT, BOTH VERY SPEEDY, DUE TO IMPACT TEMPO TUMPLED CAUSING DEATH OF 4 PEOPLE INCLUDING DRIVER OF TEMPO",,KA533696,LORRY,35,M,
32,,,FATAL,,,,,,,,,TEMPO,26,M,,,,LORRY,,M,
33,,,FATAL,,,,,,,,,TEMPO,26,M,,,,LORRY,,M,
34,,,FATAL,,,,,,,,,TEMPO,25,M,,,,LORRY,,M,
35,0012/2011,WHITEFIELD TRAFFIC PS,FATAL,2,2,40566,,SUNDAY,0.645833333,3 KM,KA03EQ7313,2W,30,F,,,KA21A3944,LORRY,27,M,DASHED TO 2W CAUSING DEATH OF MOTHER AND CHILD OF 2W
36,,,FATAL,,,,,,,,,2W,11,F,,,,LORRY,,,
37,0012/2011,K R PURAM TRAFFIC PS,FATAL,1,1,40570,,TUESDAY,0.732638889,5 KM,,PED,30,,NOT SURE IF PED IS DEAD,,KA01AE6328,CAR,,,
38,0013/2011,INDIRANAGAR TRAFFIC PS,FATAL,2,1,40555,,WEDNESDAY,0.482638889,3 KM,KA05MA5769,CAR,65,M,AUTO HIT TATA MOBILE,,KA05AA3850,3W,65,M,AUTO RASH DRIVING  HIT TATA MOBILES 
39,0013/2011,YESHWANTHPUR TRAAFFIC PS,FATAL,2,1,40557,,FRIDAY,0.875,6 KM,KA15K1043,2W,25,M,HEAD ON COLLISION CAUSING THE 2W DRIVER TO FALL DOWN,,KA04EG2805,2W,,,
40,0013/2011,R T NAGAR TRAFFIC PS,FATAL,1,1,40558,,SATURDAY,0.8125,3 KM,,PED,70,M,HIT PED ,,KA03Z6178,CAR,UNKNOWN,UNKNOWN,
41,0013/2011,BANASAWADI TRAFFIC PS,FATAL,2,1,40562,,WEDNESDAY,0.927083333,2 KM,KA536087,CAR,,M,TATA SUMO CAR HIT MERU CAR,,KA03MG3372,CAR,.,M,
42,0014/2011,PEENYA TRAFFIC PS,FATAL,1,1,40555,,WEDNESDAY,0.791666667,0.5 KM,,PED,35,M,22W HIT PED AND ON SPOT DEATH,,,2W,.,.,RASH DRVING
43,0014/2011,BANASWADI TRAFFIC PS ,FATAL,1,1,40564,,FRIDAY,0.395833333,1 KM,,PED,58,M," RASH DRIVING, HIT PED ",,KA53N3543,CAR,.,.,
44,0014/2011,YELAHANKA TRAFFIC PS,FATAL,1,1,40565,,SATURDAY,0.802083333,5 KM,,PED,50,M,RASH DRIVING AND HIT PED,,KA50K1158,2W,.,.,HIT AND RUN
45,0015/2011,ELECTRONIC CITY TRAFFIC PS,FATAL,1,1,40564,,FRIDAY,0.833333333,7 KM,,PED,80,M,RASH DRIVING AND HIT PED,,,2W,.,M,HIT AND RUN
46,0015/2011,BANASWADI TRAFFIC PS ,FATAL,1,1,40564,,FRIDAY,0.770833333,3 KM,,PED,19,M,RASH DRIVING AND HIT PED,,CTM1177,MARUTI VAN,.,M,
47,0016/2011,ELECTRONIC CITY TRAFFIC PS,FATAL,1,1,40567,,MONDAY,0.548611111,7 KM,,PED,,M,,,KA51N5532,CAR,.,M,
48,0017/2011,MADIWALA TRAFFIC P S,FATAL,2,1,40556,,TUESDAY,0.572916667,2.5 KM,KA41Q6149,2W,56,M,"RASH DRIVING BY BMTC VOLVO BUS DRIVER, PILLION RIDER GOT INJURED",,KA01FA1684,BUS(BMTC),.,M,
49,0017/2011,INDIRANAGAR TRAFFIC PS,FATAL,1,1,40556,40557,TUESDAY,0.78125,3 KM,,PED,22,M,RASH DRIVING BY LORRY TOOK LEFT TURN SUDDENLY CAUSING THE DEATH,,KA539769,TIPPER LORRY,25,M,
50,0017/2011,PEENYA TRAFFIC PS,FATAL,2,1,40557,,FRIDAY,0.5625,0.5 KM,KA01EF2232,2W,51,F,HIT 2W BOTH RIDERS FELL AND PILLION RIDER WENT UNDER TH LORRY CAUSING DEATH,,WB29A2954,LORRY,,M,
51,0017/2011,R T NAGAR TRAFFIC PS,FATAL,1,1,40560,,MONDAY,0.913194444,2 KM,,PED,48,M,HIT PED,,KA01FA2087,BUS(BMTC),,M,RASH DRVING
52,0017/2011,WHITEFIELD TRAFFIC PS,FATAL,1,1,40572,40573,SATURDAY,0.78125,,,PED,35,M,"HIT BY LORRY, THE SITE CONDITIONS ALSO CAUSL FACTOR",,KA04Z2420,LORRY,,M,HIT AND RUN
53,0018/2011,ELECTRONIC CITY TRAFFIC PS,FATAL,,,40569,,WEDNESDAY,0.625,7 KM,,PED,.,.,,,KA01EM2784,2W,,M,
54,0016/2011,KAMAKSHIPALYA TRAFFIC PS,FATAL,1,1,40571,,FRIDAY,0.4375,6 KM,KA417579,TRACTOR,38,M,"TRACTOR SPED, OUT OF CONTROL, GOT ON FOOT PATH",,,FOOT PATH,,,OUT OF CONTROL
55,0019/2011,ELECTRONIC CITY TRAFFIC PS,FATAL,1,1,40571,,FRIDAY,0.690972222,9 KM,,PED,.,M/F,,,KA05B58,2W,,M,
56,0021/2011,BYATRARAYANAPURA TRAFFIC PS,FATAL,1,1,40871,,WEDNESDAY,0.895833333,1 KM,,PED,,M,HIT AND RUNAWAY- FOOT PATH,,UNKWN,UNKWN,,UNKWN,UNKWN
57,0021/2011,BANASWADI TRAFFIC PS ,FATAL,1,1,40571,,FRIDAY,0.520833333,3 KM,,PED,5,M,,,KA04MG6479,CAR,,M,RASH DRVING
58,0023/2011,YESHWANTHPUR TRAAFFIC PS,FATAL,1,1,40568,,TUESDAY,0.875,5 KM,,PED,40,M,,,UNKWN,UNKWN,.,.,HIT AND RUN
59,0024/2011,YESHWANTHPUR TRAAFFIC PS,FATAL,1,1,40569,,WEDNESDAY,0.59375,0.1 KM,,PED,25,M,"CROSSING ROAD, BUS CAME IN HIGH SPEED AND HI THE PED, ON SPOT DEATH",,KA01F3005,BUS(BMTC),,M,
60,0026/2011,YESHWANTHPUR TRAAFFIC PS,FATAL,2,1,40572,,SATURDAY,0.520833333,2 KM,KA03ED3229,2W,64,M,CAR HIT 2W AND BOTH RIDERS FELL AND THE PILLION RIDER GOT SEVERLY INJURED AND DEAD,,KA04MB6450,CAR,.,UNKWN,UNKWN
61,0028/2011,PEENYA TRAFFIC PS,FATAL,1,1,40564,,FRIDAY,0.680555556,2 KM,,PED,55,F,"KSRTC HIGH SPEED, DASHED TO PED- ON SPOT DEATH",,KA37F432,BUS(KSRTC),.,M,
62,0037/2011,PEENYA TRAFFIC PS,FATAL,1,1,40572,,SATURDAY,0.291666667,2 KM,,PED,47,M,HIT WHILE CROSSING ROAD,,KA525134,MAXI CAB,,M,RASH DRVING
63,0005/2011,CHICKPET TRAFFIC P S,FATAL,1,2,40587,,SUNDAY,0.791666667,2 KM,,PED,85,M,HIT WHILE CROSSING ROAD,,KA05HB7825,2W,.,M/F,
64,,,FATAL,,,,,,,,,PED,67,F,HIT WHILE CROSSING ROAD,,,2W,,,
65,007/2011,PULAKESHINAGAR TRAFFIC PS,FATAL,1,1,40593,40598,SATURDAY,0.729166667,,,PED,49,M,,,KA0Q808,2W,.,M,RASH DRIVING
66,008/2011,KUMARASWAMY LAYOUT TRAFFIC PS,FATAL,2,1,40575,,TUESDAY,0.166666667,4 KM,,CYCLIST,62,M,,,GA01T6364,LORRY,.,M,LORRY CROSSING HIT THE CYCLIST
67,0010/2011,CITY MARKET TRAFFIC PS,FATAL,1,1,40577,,,0.5,1 KM,,PED,40,M,,,UNKN,UNKN,,,
68,0011/2011,CHIKKAJALA TRAFFIC PS,FATAL,1,1,40574,,MONDAY,0.652777778,15 KM,,PED,80,M,,,KA05HE4895,2W,,M/F,WHILE CROSS THE ROAD HIT THE PED
69,0011/2011,WILSONGARDEN TRAFFIC PS,FATAL,,,40576,,WEDNESDAY,0.520833333,2 KM,,TANG VEHICLE/ TROLL PULLED BY HORSE,42,F,,,KA05B1836,3W,35,M,"HIT THE TANG VEHICLE WHICH STOPPED SUDDENLY AND THE RIDER FELL ON AUTO HAVING SEVERE INJURY, DEAD"
70,0011/2011,KUMARASWAMY LAYOUT TRAFFIC PS,FATAL,1,1,40585,,FRIDAY,0.854166667,3.5 KM,,PED,60,M,"AUTO SPED, HIT THE CROSSING PED",,KA509728,3W,.,M,RASH DRIVING
71,0011/2011,UPPARPET TRAFFIC P S,FATAL,1,1,40575,,TUESDAY,0.833333333,0.5 KM,,PED,25,M,WHILE CROSSING HIT BY BUS,,KA50F083,BUS(BMTC),55,M,RASH DRIVING
72,0011/2011,ASHOK NAGAR TRAFFIC PS,FATAL,1,1,40585,,FRIDAY,0.520833333,1 KM,,PED,45,F,HIT PED AS IN REVERSE GEAR,,KA05ME3508,LCV,,,HIT AND RUN
73,0012/2011,KUMARASWAMY LAYOUT TRAFFIC PS,FATAL,1,1,40587,,SUNDAY,0.510416667,5 KM,,PED,.,M/F,,,KA01D9561,LORRY,,M,HIT THE PERSON WALKING IN OPPO. DIRECION AND HIT THE PERSON CAUSING ON SPOT DEATH
74,0012/2011,UPPARPET TRAFFIC P S,FATAL,1,1,40570,,TUESDAY,0.416666667,0.5 KM,,PED,25,M,BEGGAR -NO OTHER PROOF,,UNKN,BUS(BMTC),,M,
75,0013/2011,CHIKKAJALA TRAFFIC PS,FATAL,2,1,40579,,SATURDAY,0.777777778,0.2 KM,,2W,.,M,CAR HIT 2W WHILE 2W TRIED TO OVERTAKE FROM LEFT SIDE,,KA04B568,CAR,.,.,SPEED
76,0015/2011,K R PURAM TRAFFIC PS,FATAL,2,1,40576,,WEDNESDAY,0.802083333,4 KM,,PED,30,M,,,KA25B35,BUS,,M,"HIT PED CROSSING TH ROAD, BUS WAS SPEEDING "
77,0016/2011,HEBBAL TRAFFIC PS,FATAL,1,1,40580,,SUNDAY,0.84375,2.5 KM,,PED,43,F,"WALKING IN LEFT SIDE OF ROAD IN SAME DIRECTION, HIT BY 2W SUSTAINED INJURIES TO BOTH PED AND 2W RIDER",,KA43H984,2W,,M/F,
78,0017/2011,HEBBAL TRAFFIC PS,FATAL,1,1,40582,,TUESDAY,0.791666667,3 KM,,PED,52,M,,,KA05EM3317,2W,,M,"HT PED CROSSING THE ROAD, 2W WAS SPEEDING"
79,0017/2011,BANASHANKARI PS,FATAL,1,1,40586,,SATURDAY,0.572916667,3KM,,PED,55,F,CROSSING THE ROAD WHILE AUTO HIT,,KA05C1132,2W,,M,HIT AND RUN
80,0018/2011,BASAVANAGUDI TRAAFFIC PS,FATAL,2,2,40580,,SUNDAY,0.895833333,0.7 KM,CAZ4462,2W,47,F,THE VICTIM VEHICLE TURNED RIGHT AND HIT THE 2W COMING IN THE OPP. DIRECTION,,KA05J7493,2W,,M/F,SPEED
81,,,FATAL,,,,,,,,,2W,52,M,,,,2W,,,
82,0019/2011,CHIKKAJALA TRAFFIC PS,FATAL,,,40589,40590,TUESDAY,0.760416667,3 KM,,PED,75,M,VEHICLE IN REVERSE GEAR HIT THE VICTIM CAUSING SEVERE INJURY CAUSING DEATH,,KA04N5436,CAR,,,
83,0019/2011,BIAL TRAFFIC PS,FATAL,,,40602,,MONDAY,0.166666667,3 KM,,PED,34,M,CROSSING THE ROAD HIT BY VEHICLE,,,UNKN,,,HIT AND RUN
84,0020/2011,BASAVANAGUDI TRAAFFIC PS,FATAL,2,1,40582,,TUESDAY,0.5,05 KM,KA05HH8385,2W,28,M,HIT THE 2W CAUSING DEATH ON SAME DAY IN HOSPITAL,,KA0407,TEMPO,,M,HIT AND RUN
85,0020/2011,K R PURAM TRAFFIC PS,FATAL,2,1,40585,,FRIDAY,0.638888889,3 KM,KA53S8260,2W,45,F,"PILLION RIDER, CANTER HIT 2W CAUSING PILLION RIDERS DEATH, DRIVER OF 2W SUSTAINED MINOR INJURIES(KUMARI)",,KA096776,CANTER,,M,"HIT AND RUN, RASH DRIVING"
0,0022/2011,BANASWADI TRAFFIC PS ,FATAL,1,5,40576,,WEDNESDAY,0.96875,3 KM,KA03M2556,CAR,30,M,DRIVER UNDER ALCOHOL HIT TREE CAUSING ACCIDENT,,OBJECT,TREE,,,UNDER ALCOHOL
87,,,FATAL,,,,,,,,,CAR,21,M,,,OBJECT,TREE,,,
88,,,FATAL,,,,,,,,,CAR,21,M,,,OBJECT,TREE,,,
89,,,FATAL,,,,,,,,,CAR,20,M,,,OBJECT,TREE,,,
90,,,FATAL,,,,,,,,,CAR,21,M,,,OBJECT,TREE,,,
91,0022/2011,ELECTRONIC CITY TRAFFIC PS,FATAL,2,1,40576,,WEDNESDAY,0.84375,6 KM,KA01A6526,3W,.,M,,,,LORRY,.,M,"RASH DRIVING BY LORRY DRIVER HIT THE AUTO HE CAUSING THE DEADTH OF AUTO DRIVER, HIT AND RUN"
92,0023/2011,BANASWADI TRAFFIC PS ,FATAL,1,1,40573,,MONDAY,0.3125,2 KM,KA03J6456,2W,62,M,CAR DASHED TO THE 2W CAUSING THE DEATH OF THE SCOOTER DRIVER,,KA04MD695,CAR,.,M,
93,0024/2011,BANASWADI TRAFFIC PS ,FATAL,1,1,40576,,WEDNESDAY,0.25,4 KM,,PED,72,F,,,KA034182,CAR,.,M,RASH AND NEGLIGANT DRIVING BY CAR AND HIT PED
94,0024/2011,YELAHANKA TRAFFIC PS,FATAL,1,1,40583,,WEDNESDAY,0.875,3 KM,,PED,25,M,,,KA50M4892,CAR,,,RASH AND NEGLIGANT MANNER AND HIT THE PED WAITING FOR BUS WAS HIT BY CAR
95,0024/2011,HEBBAL TRAFFIC PS,FATAL,1,1,40601,,SUNDAY,0.354166667,3 KM,,PED,32,F,,,KA19A2304,LORRY,,M,RASH DRIVING AND HIT PED AND RAN OVER THE BODY 
96,0025/2011,RAJAJINAGAR TRAFFIC PS,FATAL,1,1,40597,,WEDNESDAY,0.229166667,5 KM,,PED,45,M,,,,CAR,30,M,HIT THE PED CAUSING DEATH
97,0025/2011,HEBBAL TRAFFIC PS,FATAL,2,1,40601,,SUNDAY,0.923611111,0.5 KM,KA01EJ6565,2W,37,M,HIT THE 2W CAUSING SEVERE INJURY ON HEAD ,,HR741415,LORRY,,M,HIT THE 2W GOING IN SAME DIRECTION
98,0027/2011,MICO LAYOUT TRAFFIC PS,FATAL,2,1,40585,,FRIDAY,0.84375,1 KM,,CYCLIST,19,M,"BOTH VEHICLE TRAVLLING IN SAME DIRECTION, CAR HIT CYCLIST CAUSING DEATH",LABOURER,KA05Z3321,CAR,.,M,
99,0027/2011,CHIKKAJALA TRAFFIC PS,FATAL,,,40601,,SUNDAY,0.930555556,2.5 KM,KA516976,CAR,37,M,CAR WENT AND HIT THE TIPPER LORRY WHICH WAS ENTERING THE ROAD ,.,,TIPPER LORRY ,.,M,
100,0028/2011,BANASWADI TRAFFIC PS ,FATAL,,,40586,,SATURDA,0.395833333,2 KM,KA03R4931,2W,40,M,CAR DASHED AGAINST THE 2W,,KA41N3322,MARUTHI VAN,.,M,
101,0029/2011,BANASWADI TRAFFIC PS ,FATAL,1,2,40588,,MONDAY,0.541666667,3 KM,KA31L7392,2W,30,M,LOST CONTROL AND DASHED TO KERB CAUSING ONE ON SPOT DEAH AND PILLION RIDER TO HAVE SEVERE INJURY LATER DEAD,,OBJECT,KERB STONE,.,.,
102,,,FATAL,,,,,,,,,2W,22,M,,,OBJECT,KERB STONE,,,
103,0030/2011,ELECTRONIC CITY TRAFFIC PS,FATAL,2,1,40593,,SATURDAY,0.655555556,3 KM,KA51U9479,2W,,F,"PILLION RIDER DEAD, VAN HIT THE 2W ",,KA52MH29,MARUTHI VAN,.,.,
104,0034/2011,BYATRARAYANAPURA TRAFFIC PS,FATAL,1,1,40592,,FRIDAY,0.347222222,4 KM,,BUS PASSENGER,74,F,WAS GETTING ON BUS THE BMTC BUS SUDDENLY STARTED AN APPLIED BRAKE CAUSING THE 2 (MOTHER AND DAUGHTER TO FELL DOWN),,KA01F8614,BUS(BMTC),.,M,
105,0035/2011,R T NAGAR TRAFFIC PS,FATAL,1,1,40587,,SATURDAY,0.9375,3 KM,,PED,56,F,"DASHED T THE PED, 2W RASH DRIVING",,KA04HB2949,2W,,M,
106,0036/2011,R T NAGAR TRAFFIC PS,FATAL,1,1,40589,,TUESDAY,0.458333333,2 KM,,PED,59,M,WAS CROSSING THE ROAD WHEN THE CAR CAME IN RASH AND NEGLIGANT MANER ANDHIT THE PED,,,CAR,25,M,HIT AND RUN
107,0039/2011,THALAGHATTAPURA P S,FATAL,1,1,40412,5/02/2011 FIR REGTR,SUNDAY,0.666666667,5 KM,KA04H9511,2W,,M,2W LOST CONTROL FALL DOWN,,LOST CONTROL,,,,
108,0039/2011,PEENYA TRAFFIC PS,FATAL,2,1,40574,,MONDAY,0.895833333,5 KM,KA02HH8501,2W,20,M,"2W HIT THE BMTC BUS AS OIT LOST CONTROL, THE DRIVER AND 2 OTHER PILLION RIDERS FELL HAVING SEVERE INJURIES, THE DRIVER DIED",,KA01F1116,BUS(BMTC),,,
109,0040/2011,PEENYA TRAFFIC PS,FATAL,2,1,40578,,FRIDAY,0.458333333,1 KM,,2W,60,M,LORRY HIT THE 2W RIDER AND THE PERSON WENT UNDER THERIGHT SIDE WHEEL,,KA525167,LORRY,,M,HIT AND RUN
110,0041/2011,YESHWANTHPUR TRAAFFIC PS,FATAL,1,1,40601,,SUNDAY,0.3125,1.5 KM,,PED,30,M,UNKNOWN VEHICLE HIT THE PED ON SPOT DEATH,,UNKNW,UNKNW,,,HIT AND RUN
111,0041/2011,PEENYA TRAFFIC PS,FATAL,2,4,40578,,FRIDAY,0.739583333,1KM,KA17F134,BUS(KSRTC),28,M,THE G/A HIT THE KSRTC AND BUS LOST CONTROL AND HIT PILLER CAUSING THE FRONT SIDE OF BUS TO CRUSHED,,KA418487,LCV,,,
112,,,FATAL,2,3,,,,,,,BUS(KSRTC),32,M,,,,LCV,,,
113,,,FATAL,,,,,,,,,BUS(KSRTC),19,M,,,,LCV,,,
114,0043/2011,THALAGHATTAPURA P S,FATAL,1,2,40581,,MONDAY,0.020833333,4 KM,,LORRY,32,M,THE LORRY WAS REPAIRED AND WENT FOR TEST DRIVE AND LOT CONTROL AND TUMBLED AND TWO PEOPLE DIED,DRIVER,,SELF ACCIDENT,,,
115,,,FATAL,,,,,,,,,LORRY,,M,,MECHANIC,,SELF ACCIDENT,,,
116,0048/2011,THALAGHATTAPURA P S,FATAL,1,3,40586,,SAT,0.1875,10 KM,KA05AB8345,BUS,33,F,SPEED CAUSED THE BUS TO LOSS CONTROL AND TUMPLED CAUSING 15-20 INJURIES AND 3 DEATH,LABOURER,,SELF ACCIDENT,,,
117,,,FATAL,,,,,,,,,BUS,27,F,,,,SELF ACCIDENT,,,
118,,,FATAL,,,,,,,,,BUS,33,F,,LABOURER,,SELF ACCIDENT,,,
119,0048/2011,PEENYA TRAFFIC PS,FATAL,2,1,40587,,SUNDAY,0.375,1.5 KM,KA04ED4220,2W,45,M,"2W HIT THE VICTIM VEHICLE ANOHER 2W CAUSING 1 DEATH, PILLION RIDERS ONE EMALE AND A 5 R OLD KID GOT HURT",.,CRM9260,2W,,,HIT AND RUN
120,0156/2011,VIJAYANAGAR TRAFFIC PS,FATAL,,,40593,,SATURDAY,0.392361111,2.6 KM,,PED,42,M,WAITING IN BUS STOP AND THE AUTO CAME AND HIT THE PEOPLE WAITING IN THE BUS STOP,.,KA403583,3W,,M,RASH DRIVING
122,0025/2011,ADUGODI TRAFFIC PS,FATAL,2,1,40657,,,0.447916667,,,CYCLIST,18,M,LORRY CAME REVERSE IN RASH MANNER AND HIT THE CYCLIST AND VICTIM WAS BROUGHT HOSPITAL DEAD,.,KA518575,LORRY,,M,HIT AND RUN
123,0028/2011,ADUGODI TRAFFIC PS,FATAL,2,1,40669,,,0.708333333,,,PED,,,PED CROSSING THE ROAD WAS HIT BY CAR,.,,CAR,.,.,HIT AND RUN
124,0033/2011,ADUGODI TRAFFIC PS,FATAL,1,1,40700,,,0.9375,,,PED,,M,,,KA53U4105,2W,,M,
125,0043/2011,ADUGODI TRAFFIC PS,FATAL,1,1,40720,,,0.4375,,,PED,50+,M,HIT PED AND RAN AWAY,,KA016703,2W,.,M,HIT AND RUN
126,0045/2011,ADUGODI TRAFFIC PS,FATAL,1,1,40726,,,0.822916667,,,2W,33,M,SUDDEN BREAK AS 2W IN FRONT WAS TAKING A RIGHT TURN AND CAUSED SELF SKID AND RIDDERS FELL DOWN,,,2W,25,M,SELF SKID 
127,0047/2011,ADUGODI TRAFFIC PS,FATAL,,,40733,,,0.895833333,,,PED,,,"2W HIT PED, THE 2W PILLION RIDDER AND THE DRIVER FELL DOWN ALONG WITH VEHICLE AND INJURED, ALSO THE PEDESTRIAN",,KA01EA899,2W,,,
128,,,FATAL,,,,,,,,,2W (PILLION RIDER),,,,,,PED,,,
129,0048/2011,ADUGODI TRAFFIC PS,FATAL,1,1,40735,,,0.416666667,,KA37584,TRACTOR,30,M,"VICTIM WAS SITTING BESIDE DRIVER, IMBALANCED FELL AND TYRE WENT OVER THE STOMACH OF VICTIMM",,KA37584,TRACTOR,,M,
130,0049/2011,ADUGODI TRAFFIC PS,FATAL,1,1,40735,,,0.645833333,,,PED,25,M,"RASH DRIVING BY BMTC BUS, TOOK LEFT TURN HIT THE PED AND CAUSING ON SPOT DEATH",,KA01FA167,BUS(BMTC),,M,HIT AND RUN
131,0057/2011,ADUGODI TRAFFIC PS,FATAL,,,40769,,,0.916666667,,CTM6991,2W,52,M,,,KA41K1008,2W,,M,
132,,,FATAL,,,,,,,,,2W,,F,,,,2W,,,
133,0064/2011,ADUGODI TRAFFIC PS,FATAL,2,1,40789,,,0.166666667,,TN43B9637,2W,26,M,"LORRY DASHED TO 2W, RASH DRIVING BY LORRY, VICTIM BROUGHT DEAD TO HOSPITAL",,KA40A7506,LORRY,,M,HIT AND RUN
134,0065/2011,ADUGODI TRAFFIC PS,FATAL,1,1,40790,,,0.0625,,HR26AZ7645,CAR,26,M,"VICTIM CAR HIT THE MEDIAN AND FLEW TO THE OPP. ROAD AND HIT MERU CAB, BOTH THE DRIVERS OF CAR GOT INJURED AND RIDER ALONG WITH VICTIM. VICTIM DIED ON SPOT",,OBJECT,KERB,.,.,.
135,0067/2011,ADUGODI TRAFFIC PS,FATAL,1,1,40797,,,0.875,,,PED,75,M,PED WAS CROSSING THE ROAD WHEN HIT BY TEMPO,,GA02Z8772,TEMPO,,M,
136,0070/2011,ADUGODI TRAFFIC PS,FATAL,2,2,40809,,,15:35 PM,,KA51V4774,2W,16,M,"BMTC DASHED TO 2W FROM BEHIND, RAN OVER BOTH DRIVER AND PILLION RIDER HEAD, ON SPOT DEATH",,KA01FA2284,BUS(BMTC),.,M,HIT AND RUN
137,,,FATAL,,,,,,,,,2W,16,M,,,,BUS(BMTC),,,
138,0071/2011,ADUGODI TRAFFIC PS,FATAL,2,1,40813,,,0.9375,,KA03EC2546,2W,23,M,WAS HIT FROM BEHIND BY UNKNOWN VEH,,UNKNW,UNKNW,,,HIT AND RUN
139,0073/2011,ADUGODI TRAFFIC PS,FATAL,1,1,40819,,,0.4375,,,PED,68,F,"PED CROSSING THE ROAD WAS HIT BY BUS, BUS RAN OVER BODY AND PED DIED ON SPOT",,KA01F4796,BUS(BMTC),,M,
140,0076/2011,ADUGODI TRAFFIC PS,FATAL,1,1,40827,,,0.479166667,,,PED,86,M,CROSSING THE ROAD WHEN VEHICLE HIT PED AND AGAIN THE ACCUSED CAR HIT ANOTHER CAR COMING FROM OPP. DIRECTION,,KA03MH3611,CAR,,F,HIT ANOTHER CAR ALSO OF NUMBER KA25P494
141,0084/2011,ADUGODI TRAFFIC PS,FATAL,2,1,40853,,,0.142361111,,KA03H2653,2W,59,M,"DASHED TO M/C GOING IN SAME DIRECTION, LORRY RAN OVER RIDERS HEAD DIED WHILE TAKING TO HOSPITAL",,KA01C5510,LORRY(CONCRETE MIXER),,M,
142,0085/2011,ADUGODI TRAFFIC PS,FATAL,1,1,40853,,,0.899305556,,,PED,.,.,PED WAS CROSSING THE ROAD WHEN HIT BY 2W,,KA03HF8784,2W,,M,RASH AND NEGLIGANT DRIVING
143,0088/2011,ADUGODI TRAFFIC PS,FATAL,1,1,40867,,,0.15625,,KA01S4504,2W,27,M,"RODE SAME SPEED THROUGH THE CURVE AND HIT THE WALL, ON SPOT DEATH OF RIDER AND PILLION RIDER GOT GREVIOUS INJURY OF 28 YRS MALE",,OBJECT,WALL,,,
144,0099/2011,ADUGODI TRAFFIC PS,FATAL,2,1,40908,,,0.229166667,,KA05EV7266,2W,22,F,"HIT THE 2W FROM BEHIND CAUSING BOTHRIDERS IN 2W GREVIOUS INJURY, CAUSING ONE DEATH",,,CAR,,M,"RASH AND NEGLIGANT DRIVING, HIT AND RUN"
145,0018/2011,AIRPORT TRAFFIC PS,FATAL,1,1,40608,,,0.479166667,,,PED,55,F,"PED WAS CROSS IN NORTH SOUTH DIRECTION, 2W CAME FROM EAST WEST DIRECTION AND HIT THE PED",,KA03HA9589,2W,.,M,RASH DRIVING
146,0024/2011,AIRPORT TRAFFIC PS,FATAL,4,1,40630,,,0.743055556,,KA03EE9400,2W,25,M,"GOODS VEHICLE HIT GOODS CANTER COMING IN OPP. DIRECTION AND DASHED AGAINST A 2W AND ANOTHER ACTIVA(2W), DRAGGING THE FIRST 2W RIDER. ACTIVA RIDERS SUSTAINED MINOR INJURY",,KA05A746,GOODS VEHICLE,,M,"OTHER VEHICLES INNVOLVED, ANOTHER GOODS CANTER, AND TWO 2W"
147,0026/2011,AIRPORT TRAFFIC PS,FATAL,1,1,40630,,,0.822916667,,,PED,65,M,PED CROSSING THE ROAD WAS HIT BY 2W,,KA02ET4912,2W,,M,
148,0037/2011,AIRPORT TRAFFIC PS,FATAL,2,1,40666,,,0.59375,,KAO3B8783,LCV,45,M,THE VICTIM VEHICLE TOOK SUDDEN RIGHT TURN AND CAME AND HIT TIPPER LORRY,,KA533169,TIPPER LORRY,,M,
149,0046/2011,AIRPORT TRAFFIC PS,FATAL,2,1,40699,,,0.958333333,,KA03HB7797,2W,,M,"BOTH VEHICLES COMING IN OPP DIRECTION, TRACTOR NEGLIGANT DRIVING HIT THE 2W , VICTIM BROUGHT DEAD TO HOSPITAL",,KA40T4584,TRACTOR TROLLY,,M,HIT AND RUN
150,0048/2011,AIRPORT TRAFFIC PS,FATAL,2,1,40704,,,0.416666667,,KA01EP9233,2W,23,F,"WATER TANKER WAS HIT FROM BEHIND THE 2W TRAVELLING IN THE SAME DIRECTION, VICTIM DIED ON THE SAME DAY.",,KA53T45,TRACTOR WATER TANKER,,M,HIT AND RUN
151,0049/2011,AIRPORT TRAFFIC PS,FATAL,2,1,40715,,,0.5,,KA53U5210,2W,,M,"WATER TANKER HIT FROM BEHIND,FELL ON ROAD AND THE TANKER RAN OVER THE VICTIM,VICTIM ON SPOT DEATH",,,LORRY,,M,RASH DRIVING
152,0050/2011,AIRPORT TRAFFIC PS,FATAL,1,1,40718,,,0.28125,,,PED,55,F,PED CROSSING THE ROAD HIT BY THE 2W,,KA02EF6136,2W,,M,HIT AND RUN
153,0058/2011,AIRPORT TRAFFIC PS,FATAL,1,1,40739,,,0.21875,,,PED,40,M,"UNKONWN VEHICLE DASHED TO PED, VICTIM DIED ON SPOT",,UNKNW,UNKNW,,M,HIT AND RUN
154,0069/2011,AIRPORT TRAFFIC PS,FATAL,2,1,40755,,,0.854166667,,TN57L0100,2W,22,M,"BOTH VEHICLE IN SAME DIRECTION, BUS HIT BEHIND THE 2W",,KA01FA980,BUS(BMTC),,M,HIT AND RUN
155,0071/2011,AIRPORT TRAFFIC PS,FATAL,2,1,40757,,,0.729166667,,KA53U4001,2W,,F,"TEMPO DRIVER HIT THE 2W BEHIND AND BOTH RIDERS FELL, ONE RIDER DIED AND OTHER SUSTAQINED INJURIES",,,TEMPO,,M,HIT AND RUN
156,0075/2011,AIRPORT TRAFFIC PS,FATAL,1,1,40763,,,0.40625,,KA04EV4712,2W,31,M,"2W RIDER WAS OVER TAKING CAR IN RASH MANNER WHEN SAW CYCLIST APPLIED SUDDEN BREAK , PILLION RIDER LOST BALANCE AND FELL, HIT THE MEDIAL GRILL HURTING THE NECK, BROUGHT TO HOSPITAL DEAD",,OBJECT,MEDIAN,,,
157,0076/2011,AIRPORT TRAFFIC PS,FATAL,1,1,40763,40764,,0.927083333,,,PED,,M,PED CROSSING THE ROAD WAS HIT BY CAR,,KA01C790,CAR,,M,
158,0078/2011,AIRPORT TRAFFIC PS,FATAL,1,1,40766,40774,,0.4375,,,PED,73,M,PED CROSSING ROAD WAS HIT BY 2W,,KA03EQ4264,2W,26,M,RASH AND NEGLIGANT MANNER
159,0082/2011,AIRPORT TRAFFIC PS,FATAL,1,1,40775,,,0.645833333,,,PED,30,M,PED CROSSING THE ROAD WAS HIT BY TEMPO,,KA014635,TEMPO,,M,RASH AND NEGLIGANT MANNER
160,0083/2011,AIRPORT TRAFFIC PS,FATAL,1,1,40782,,,0.5,,,PED,21,M,DASHED PED RAN OVER THE VICTIM,,,MOBILE CRANE ,,M,CRANE LIFTED IRON AND DROVE RASHLY
161,0084/211,AIRPORT TRAFFIC PS,FATAL,1,1,40782,,,0.114583333,,,PED,38,M,DASHED PED WHO WAS CROSSING THE ROAD,,KA01FA1821,BUS(BMTC),,M,RASH DRIVING
162,0087/2011,AIRPORT TRAFFIC PS,FATAL,1,1,40636,,,N/A,,,PED,80,F,"UNKONWN VEHICLE DASHED TO PED, VICTIM DIED ON SPOT",,,UNKNWN,.,.,HIT AND RUN
163,0088/2011,AIRPORT TRAFFIC PS,FATAL,1,1,40791,,,0.90625,,,PED,23,M,CROSSING THE ROAD WHEN VEHICLE HIT PED ,,KA53T1373,TRACTOR,,M,HIT AND RUN
164,0095/2011,AIRPORT TRAFFIC PS,FATAL,2,1,40807,,,0.5625,,KA51EV350,2W,29,M,"2W MOVING IN SAME DIRECTION WAS HIT BY LORRY, WHEELS RAN OVER VICTIMS HEAD, DIED ON SPOT",,KA423808,LORRY,,M,HIT AND RUN
165,0098/2011,AIRPORT TRAFFIC PS,FATAL,2,1,40811,,,0.802083333,,MHO4BZ266,2W,23,M,"HIT 2W AND 2W RIDER FELL DOWN AND BUS RAN OVER HIS HEAD, ON SPOT DEATH",,KA01FA521,BUS(BMTC),,M,HIT AND RUN
166,0101/2011,AIRPORT TRAFFIC PS,FATAL,1,1,40824,,,0.041666667,,,PED,28,M,PED WAS CORSSING THE ROAD WHEN VEHICLE HIT,,.,CAR,,M,HIT AND RUN
167,0102/2011,AIRPORT TRAFFIC PS,FATAL,2,1,40827,,,0.708333333,,KA04EH3015,2W,22,M,"TANKER DIDN'T FOLLOW LANE DISPLINE AND HIT ON 2W GOING IN SAME DIRECTION, RAN OVER 2W AND PILLION DRIVER",,KA02AA4434,TANKER LORRY,,M,HIT AND RUN
168,0114/2011,AIRPORT TRAFFIC PS,FATAL,1,1,40863,,,0.836805556,,,PED,28,M,PED CROSSING ROAD WAS HIT BY CAR,,,CAR,.,M,HIT AND RUN
